entry_date,origin_countries,target_countries,start_date,end_date,announced_date,budget_usd,fb_accounts,fb_pages,fb_pages_followers,fb_groups,fb_groups_followers,Events,ig_accounts,ig_followers,affiliation,keywords,description,source,url
05/06/2020,Iran,"Algeria, Bangladesh, Bosnia, Egypt, Ghana, Libya, Mauritania, Morocco, Nigeria, Senegal, Sierra Leone, Somalia, Sudan, Tanzania, Tunisia, USA, UK, Zimbabwe",,,05/05/2020,"1,600",389,118,"318,000",27,"67,000",,6,"135,000",The Islamic Republic of Iran Broadcasting Corporation,"Syria, Arab Spring, News, Libya, Turkey, Elections, Saudi Arabia, Al Qaeda in Africa, USA, The Occupy Movement","Posted about the Arab Spring protests, the tensions between Libya and Turkey, criticism of Saudi involvement in the Middle East and Africa, Al Qaeda’s actions in Africa, the Occupy movement in the US, criticism of US policies in the Middle East and the 2012 US elections.",FB internal investigation,https://about.fb.com/news/2020/05/april-cib-report/
05/06/2020,USA,USA,,,05/05/2020,1,20,5,"133,000",6,"30,000",,0,,QAnon,"Elections, Conspiracy Theories, Coronavirus","Posted about news and topics including the upcoming presidential election and candidates, the current US administration, anti-Semitic and anti-Asian conspiracies, and COVID-19. While it did not appear to be the focus of this campaign, some of the individuals behind this effort attempted to monetize their clickbait content by selling t-shirts and other merchandise",FB internal investigation,https://about.fb.com/news/2020/05/april-cib-report/
05/06/2020,USA,USA,,,05/05/2020,"114,000",15,19,"207,700",1,20,,0,,"VDARE, a website known for posting anti-immigration content, and The Unz Review","Elections, News, Trump, Anti-immigration, Far-right, Asian-Americans, Coronavirus, Conspiracy Theories","They frequently posted about US news and topics including the US President, ideologies recognized as far-right, and anti-immigration content. Most recently, this network shared COVID-19-related conspiracies and hate speech about Asian Americans",FB internal investigation,https://about.fb.com/news/2020/05/april-cib-report/
05/06/2020,Mauritania,Mauritania,,,05/05/2020,190,75,11,"62,500",,,,90,"25,000",,"Libya, Yemen, Qatar, Turkey, Iran, UAE, Coronavirus","They posted primarily in Arabic and some in English and French about domestic and regional news and topics including the civil wars in Libya and Yemen, criticism of Qatar, Turkey and Iran, Qatar’s treatment of migrant workers, as well as support for the president of Mauritania and the United Arab Emirates. They also posted about the Coronavirus pandemic",FB internal investigation,https://about.fb.com/news/2020/05/april-cib-report/
05/06/2020,Myanmar,Myanmar,,,05/05/2020,20,18,3,"19,000",1,30,,,,Myanmar Police Force,"Rohingya, Military, Coronavirus, News","The Page admins and account owners shared content primarily in Burmese about local news and events such as the successes of the national police and military, stories about police officers providing assistance to local families, arrests and police raids, criticism of the Arakan Army and anti-Rohingya content. Also posted about the Coronavirus pandemic",FB internal investigation,https://about.fb.com/news/2020/05/april-cib-report/
05/06/2020,Georgia,Georgia,,,05/05/2020,"30,000",101,511,"973,000",122,"1,508, 000",,56,"26,000","Espersona, a media firm in Georgia","News, Elections, Coronavirus","Posted about domestic news and political issues such as elections, government policies and officials, as well as criticism of the opposition, journalists and local activists. Most recently, this network shared some content about COVID-19",FB internal investigation,https://about.fb.com/news/2020/05/april-cib-report/
05/06/2020,Georgia,Georgia,,,05/05/2020,"23,800",23,80,"785,000",41,"6,300",22,9,"6,400","United National Movement, a political party in Georgia","Religion, News, Elections, Coronavirus","Posted about local news and political topics like the 2018 Georgian elections and candidates, Georgian Orthodox Church, criticism of the ruling party and the government’s handling of the coronavirus pandemic",FB internal investigation,https://about.fb.com/news/2020/05/april-cib-report/
"","","","","","","","","","","","","","","","","","","",""